{
  "$schema": "executable-quality-contract-lock.schema.json",
  "lockVersion": "EXECUTABLE-QUALITY-CONTRACT-LOCK-1.0.0",
  "profileVersion": "QMDP-1.0.0",
  "catalogVersion": "DCC-1.1.0",
  "qualityGateVersion": "QG-1.0.0",
  "policyCanonicalDigest": "sha256:c574eda413a5d3f7e9e8406f117a91dee8a7874beb82c19166c06584f6051bc8",
  "lifecycleCanonicalDigest": "sha256:e63ae10e548defb785be8e11ebd1354440242de504887cc0a8582ae8274c60b0",
  "retentionCanonicalDigest": "sha256:1770fc6fa8e58b6853dbdca7dde3dec9aac0da8a89f7840c86ce252f00ebcae0",
  "digests": {
    "_bmad-output/planning-artifacts/delegated-decision-baseline-2026-07-17.md": "sha256:94e0943902140ee0d3f79fceab711e1498a6186a0402f7a26bf7f20bf7c9d97a",
    "_bmad-output/planning-artifacts/sprint-change-proposal-2026-08-08.md": "sha256:3e63dd42179adb48bed6b405e266cefda45cee3de4335aa29caf5c96e767f1f5",
    "contracts/audit-retention/audit-retention-contract-lock-1.0.0.json": "sha256:321755d18d6de7ee8eef436bd070a5d5f6ad94773bbbe686ba89b0cf21926c8b",
    "contracts/audit-retention/deletion-receipt-conformance.schema.json": "sha256:ac8be47069b23a9885d361ee513ec9d1880b080c86278cdba6ab2791fcc356bc",
    "contracts/data-catalog/data-source-catalog-1.1.0.schema.json": "sha256:2b967a7b89cd8febed7cc3d2a59d79e7e702ac2b638058bfb452e9a6672695f2",
    "contracts/data-catalog/dcc-1.1.0.json": "sha256:aeb19962071e2144a85bb2e07fd124eff0d69edf93f7202e821204616a60f219",
    "contracts/data-catalog/qg-1.0.0.json": "sha256:1789c6099ef3a48b87714394c903449c8f75b9ce92cba300f752da33f7e2bced",
    "contracts/data-catalog/sources/src-p0-accommodation-001.schema.json": "sha256:02f9e41e259cf060b239596921ead3ebefc0185e2f2be47086c411551147c66b",
    "contracts/data-catalog/sources/src-p0-calendar-001.schema.json": "sha256:644b1f9e1822282c2bb160960674ff297556fde891b0050f86bd440d714b2a35",
    "contracts/data-catalog/sources/src-p0-campus-access-001.schema.json": "sha256:cf13f846f309439b429325663eef77a91e736d2a35140d7e093159dcab835ae9",
    "contracts/data-catalog/sources/src-p0-card-001.schema.json": "sha256:b9c3cf57629bc7ffcb922bb409db65815f4fd5778c5374c7dbaf43a0fa4d0863",
    "contracts/data-catalog/sources/src-p0-device-001.schema.json": "sha256:dfa28528c5133237c9614e7358797bfd8fb2b2991370266fd23186a5a9fb54b5",
    "contracts/data-catalog/sources/src-p0-dorm-access-001.schema.json": "sha256:924e65f35794fbc17f6a95bc78086a51b98adaca1ca6ba62d0967e0e50a76761",
    "contracts/data-catalog/sources/src-p0-leave-001.schema.json": "sha256:d2d371b25ae17294c3f62ad354a4ca5c7d95948c078cce56241a5bdae5ad1f1a",
    "contracts/data-catalog/sources/src-p0-responsibility-001-2.1.0.schema.json": "sha256:a5e3b7a1673b0c55d09eadd4cc491be297aa46f24dc83bc6e56053a33b8b86a1",
    "contracts/data-catalog/sources/src-p0-student-001.schema.json": "sha256:f144b3bdf93bc1582fb12e5051d7f8720cb98ff69f47dc3f50e3ff328027258e",
    "contracts/data-catalog/sources/src-p0-timetable-001.schema.json": "sha256:731f794b77121f481cd6ec36a7213c57dc28c053b389bde83924ad2a7fe49fd2",
    "contracts/data-catalog/sources/src-p1-academic-001.schema.json": "sha256:932d51b5c9baf7582cd65087f720b271beccfa3091a052f42b65883c6360e576",
    "contracts/data-catalog/sources/src-p1-aid-001.schema.json": "sha256:dc0959fdadb225b0bdef37df16178add314119a57502adda12cea876a2728e5e",
    "contracts/data-catalog/sources/src-p1-care-list-001-1.1.0.schema.json": "sha256:d4ed4ca282b12c23024600635546729be6550ff1b3c773209dd3c2634a4c9e01",
    "contracts/data-catalog/sources/src-p1-network-001.schema.json": "sha256:9afcf25961c545225699188293cc9f325e8d79e06afec556626c114b00f8f0f2",
    "contracts/data-catalog/sources/src-p1-offcampus-001.schema.json": "sha256:662f7790391ec9c86dd132a3fd5e7ca75e7d56d02a8283cba8f50d8c3c130c5c",
    "contracts/data-catalog/sources/src-p1-psych-deid-001.schema.json": "sha256:7c849d9eda97334a5c8857677b42a745b1a7d61065b96506ba9c348952fd419c",
    "contracts/data-catalog/sources/src-p1-work-visit-001.schema.json": "sha256:05c8bfa784ec5f05d878a641de1d2c999a0d4420f0fdb5e6d9368f817e0821fb",
    "contracts/events/envelope.schema.json": "sha256:10d75ab24a6df63a2520f263ba29c9f6f45bc5e78165deb20109b37fd4eadd6d",
    "contracts/events/ingestion-quality/fixtures/ordering/quality-snapshot-deletion-ordering-1.0.0.json": "sha256:0439a547c9d085e89d56589d73e285bce1ae1db54b017fd2ff065efba0014444",
    "contracts/events/ingestion-quality/fixtures/valid/quality-snapshot-deletion-blocked-v1.json": "sha256:b0d11e728bc7532698011f6fd943aa12cdaeed02d7a9a65ad209dfd499066b04",
    "contracts/events/ingestion-quality/fixtures/valid/quality-snapshot-deletion-completed-v1.json": "sha256:a74a57d80584764636321129e552f216b77acdb8921e6d33f654dac7a1ae1c5f",
    "contracts/events/ingestion-quality/fixtures/valid/quality-snapshot-deletion-failed-v1.json": "sha256:94d76ea91d889c9e938121d3141c7da5b1906dba32590bc10f6dfa668d32e8cc",
    "contracts/events/ingestion-quality/fixtures/valid/quality-snapshot-deletion-partial-v1.json": "sha256:56b23187885c2d21885dc4dd39dda179b235e2731b7237d807662aa4b24a9013",
    "contracts/events/ingestion-quality/quality-snapshot-deletion-result.schema.json": "sha256:7d1924966c69cf2465152ca945a4f8b12b7969f7e78adbcd5416fe53bfc3b754",
    "contracts/field-projection/field-projection-contract-lock-1.1.0.json": "sha256:91270f357115d3e7f9273723b677143e6d3adbc5a9a0e3f249279c64ebbd5a11",
    "contracts/ingestion-quality/batch-quality/batch-quality-lifecycle-1.0.0.json": "sha256:97d7f484ed7a3a2dfd3ff0a1ecac83fcfdacc5d0e0e97e9a0f0b6b8b7477ea64",
    "contracts/ingestion-quality/batch-quality/batch-quality-lifecycle.schema.json": "sha256:aa5f99a2ce24d76797418cf65031ad2bd84eade22ad45d72f5f4cb6d50ca0111",
    "contracts/ingestion-quality/batch-quality/executable-quality-contract-lock.schema.json": "sha256:38435ea6e4f733768ac4a52b8a80104fa12b54fa94e4e1546674540970538028",
    "contracts/ingestion-quality/batch-quality/executable-quality-policy-1.0.0.json": "sha256:1e7703748a7bda56034ab189700a82a503674d364ecac67c1eb35fe6ee8c0d84",
    "contracts/ingestion-quality/batch-quality/executable-quality-policy.schema.json": "sha256:50e3649d9f6671befc37f1dd0448ae86c965a05306a3fe372d5dd768457404bd",
    "contracts/ingestion-quality/batch-quality/fixtures/invalid/negative-fixtures-1.0.0.json": "sha256:08285d01262b45c8bc38d9d08082c7e297986511d73bdd3080dc15f80b0d5839",
    "contracts/ingestion-quality/batch-quality/fixtures/invalid/task-0-4-negative-fixtures-1.0.0.json": "sha256:07ab865e75e0bba7267b79e326649b51de02d8ade6582fb752d740dc2e7929cf",
    "contracts/ingestion-quality/batch-quality/fixtures/valid/quality-metric-vectors-1.0.0.json": "sha256:6205975f964932ee43d84a23210ea697d5bb9b9a8aad80e6fb3dd63992dc8049",
    "contracts/ingestion-quality/batch-quality/fixtures/valid/quality-snapshot-retention-vectors-1.0.0.json": "sha256:d94179d617c7e73264229cacadca29f9a20a19123969f64a298901c966333877",
    "contracts/ingestion-quality/batch-quality/metric-definition.schema.json": "sha256:14a7d2afae03653e6d7832e680e64995a441df3dc71a0fb2df706e4e82a83cb4",
    "contracts/ingestion-quality/batch-quality/quality-metric-vectors.schema.json": "sha256:c1c47463f73a64139fb37c048628abe9c49274ea1e2697102d12c2b8fe241509",
    "contracts/ingestion-quality/batch-quality/quality-snapshot-retention-1.0.0.json": "sha256:e312ac071a3dba98709edaee772a354a23df26a0d311dbcb8be99f30629aba48",
    "contracts/ingestion-quality/batch-quality/quality-snapshot-retention-vectors.schema.json": "sha256:51df5537a9f8b62648711ee195718706501d7a474e7ebfea569db4033168d8c6",
    "contracts/ingestion-quality/batch-quality/quality-snapshot-retention.schema.json": "sha256:d82f9ab8101e262e57282e570dc3bb4334c13c6b877822593bfd28261fd662ea",
    "contracts/release/canonical-json-profile-1.0.0.json": "sha256:28cfa27dfc947d1a352f2e68e9f5df7274d582dcc666a3a46f13f65898a15245",
    "contracts/release/canonical-json-test-vectors-1.0.0.json": "sha256:8d130b1c22e4fce8ff4fa8c2eff6bde6d5dc20cede7721fd8e71ed6c6dbbc0a7"
  }
}
